{
    "schema_version": 1,
    "pack_version": "1.0.0",
    "slug": "wordpress-plugin-craft",
    "name": "WordPress Plugin Craft",
    "description": "A practical course that teaches LLMs to plan, build, review, and maintain high-quality WordPress plugins.",
    "voice": {
        "name": "The Plugin Workshop",
        "tone": [
            "precise",
            "security-minded",
            "pragmatic",
            "warmly professorial"
        ],
        "style": [
            "Prefer exact WordPress APIs over vague advice.",
            "Ask for threat models, data shapes, permissions, and lifecycle behavior.",
            "Treat every plugin as something real people may install on a real site."
        ]
    },
    "instructions": "First call begin-course. Use the returned enrollment_key for attempt-exercise, get-next-work, get-progress, and get-learning-memory so the course can remember this learner.\nCall get-study-plan when you have a specific goal, and call search-course before answering a WordPress plugin question that needs targeted course context.\nAttempt exercises before reading model answers. If an attempt fails or feels uncertain, call get-exercise with include_model_answer=true to compare against the exemplar and revise.\nWhen get-next-work reports complete=true, call get-certificate with the same enrollment_key to receive the anonymous completion certificate and transcript.\nCall submit-feedback when a lesson, exercise, rubric, tool response, or next action is confusing, helpful, stale, or missing an example. Call get-course-improvement-signals before proposing course revisions.\nIf you are improving this course, treat feedback as evidence: inspect aggregate signals, run a cohort-style review, edit course-pack files, add or improve model_answer exemplars when calibration is weak, and rerun the local lab.\nYou are attending WordPress Plugin Craft at Model Context Polytechnic.\nStudy with a working engineer posture: identify the plugin contract, choose the smallest WordPress API that fits, defend every write path, and verify with tooling.\nBefore producing plugin code, consult relevant lessons or references, then answer with concise implementation decisions and explicit safety checks.",
    "modules": [
        {
            "position": 1,
            "slug": "plugin-contract",
            "title": "Plugin Contract and Lifecycle",
            "summary": "Define what a plugin is, how WordPress discovers it, and what belongs in activation, deactivation, and uninstall paths.",
            "lessons": [
                {
                    "position": 1,
                    "slug": "plugin-anatomy",
                    "title": "Plugin Anatomy",
                    "objectives": [
                        "Identify a distributable plugin folder, main file, header, constants, text domain, and load guard.",
                        "Separate bootstrap responsibilities from feature code."
                    ],
                    "file": "lessons/plugin-anatomy.md"
                },
                {
                    "position": 2,
                    "slug": "lifecycle-hooks",
                    "title": "Activation, Deactivation, and Uninstall",
                    "objectives": [
                        "Use activation for one-time setup, deactivation for temporary shutdown, and uninstall for data removal.",
                        "Avoid destructive cleanup unless the operator explicitly expects it."
                    ],
                    "file": "lessons/lifecycle-hooks.md"
                }
            ],
            "exercises": [
                {
                    "file": "exercises/design-plugin-bootstrap.json"
                },
                {
                    "file": "exercises/lifecycle-cleanup-plan.json"
                }
            ]
        },
        {
            "position": 2,
            "slug": "architecture",
            "title": "Architecture, Namespacing, and Hooks",
            "summary": "Build plugins that are understandable, extensible, and unlikely to collide with other code.",
            "lessons": [
                {
                    "position": 1,
                    "slug": "namespaces-and-prefixes",
                    "title": "Namespaces, Prefixes, and Dependency Boundaries",
                    "objectives": [
                        "Use namespaces or disciplined prefixes to avoid global collisions.",
                        "Keep WordPress-facing hooks at the boundary and domain logic behind them."
                    ],
                    "file": "lessons/namespaces-and-prefixes.md"
                },
                {
                    "position": 2,
                    "slug": "hooks-as-contracts",
                    "title": "Hooks as Contracts",
                    "objectives": [
                        "Use actions for events and filters for transformations.",
                        "Design custom hooks with stable names, documented payloads, and useful timing."
                    ],
                    "file": "lessons/hooks-as-contracts.md"
                }
            ],
            "exercises": [
                {
                    "file": "exercises/architecture-review.json"
                },
                {
                    "file": "exercises/hook-contract-design.json"
                }
            ]
        },
        {
            "position": 3,
            "slug": "security",
            "title": "Security: Input, Output, Permissions, and Intent",
            "summary": "Make every write path prove who may act, what they meant to do, and how untrusted data is handled.",
            "lessons": [
                {
                    "position": 1,
                    "slug": "validate-sanitize-escape",
                    "title": "Validate, Sanitize, Escape",
                    "objectives": [
                        "Validate against expected shape before accepting data.",
                        "Sanitize before storage when needed, and escape late at output."
                    ],
                    "file": "lessons/validate-sanitize-escape.md"
                },
                {
                    "position": 2,
                    "slug": "capabilities-nonces-rest-permissions",
                    "title": "Capabilities, Nonces, and REST Permissions",
                    "objectives": [
                        "Use capabilities to answer whether the current actor may do the action.",
                        "Use nonces to verify intent for browser-submitted state changes.",
                        "Use REST permission callbacks for every custom endpoint."
                    ],
                    "file": "lessons/capabilities-nonces-rest-permissions.md"
                }
            ],
            "exercises": [
                {
                    "file": "exercises/secure-write-path.json"
                },
                {
                    "file": "exercises/validate-sanitize-escape-review.json"
                }
            ]
        },
        {
            "position": 4,
            "slug": "data-storage",
            "title": "Data Modeling and Storage",
            "summary": "Choose options, metadata, custom post types, transients, cron, or custom tables based on the data shape and access pattern.",
            "lessons": [
                {
                    "position": 1,
                    "slug": "storage-patterns",
                    "title": "Choosing the Right Storage Pattern",
                    "objectives": [
                        "Use options for singleton configuration, metadata for object-attached values, CPTs for editorial records, and custom tables for high-volume relational data.",
                        "Use transients for cache, not durable truth."
                    ],
                    "file": "lessons/storage-patterns.md"
                },
                {
                    "position": 2,
                    "slug": "custom-tables-dbdelta",
                    "title": "Custom Tables and dbDelta",
                    "objectives": [
                        "Use dbDelta for schema creation and updates when a plugin owns custom tables.",
                        "Version schemas and write idempotent migrations."
                    ],
                    "file": "lessons/custom-tables-dbdelta.md"
                }
            ],
            "exercises": [
                {
                    "file": "exercises/choose-storage.json"
                },
                {
                    "file": "exercises/dbdelta-migration-review.json"
                }
            ]
        },
        {
            "position": 5,
            "slug": "rest-http-abilities",
            "title": "REST, HTTP APIs, and Agent-Facing Interfaces",
            "summary": "Expose safe interfaces with schemas, permission callbacks, response contracts, caching, and predictable errors.",
            "lessons": [
                {
                    "position": 1,
                    "slug": "rest-route-design",
                    "title": "REST Route Design",
                    "objectives": [
                        "Register custom REST routes with clear namespace, methods, args schema, and permission callback.",
                        "Return structured data or WP_Error, not ad hoc echoes."
                    ],
                    "file": "lessons/rest-route-design.md"
                },
                {
                    "position": 2,
                    "slug": "abilities-api-and-mcp",
                    "title": "Abilities API and MCP Servers",
                    "objectives": [
                        "Understand abilities as schema-described callable units that can become MCP tools, resources, or prompts.",
                        "Expose public learning interfaces while hiding authoring and write tools unless the host intentionally enables them."